{
  "schema": "gentle-ai.review-integration.start/v2",
  "contract": "gentle-ai.review-integration/v1",
  "operation": "review.start",
  "action": "created",
  "lenses_required": true,
  "lineage_id": "review-start-fixture",
  "state": "reviewing",
  "risk_level": "high",
  "selected_lenses": [
    "review-risk",
    "review-resilience",
    "review-readability",
    "review-reliability"
  ],
  "projection": "workspace",
  "changed_files": 1,
  "changed_lines": 1,
  "correction_budget": 1,
  "risk_reasons": [
    {
      "code": "shell_source",
      "signal": "shell_process",
      "path": "scripts/deploy.sh"
    }
  ],
  "artifact_subjects": [
    {
      "schema": "gentle-ai.review-artifact-subject/v1",
      "subject_hash": "sha256:462591bc0cfab672cdf741536c5f1d8122a1f31b1773b9f1d12c5f2b72c76d23",
      "lineage_id": "review-start-fixture",
      "authority_revision": "sha256:e10bced7198e3c817c5ff6d1172d6aa8ce3321d45ec4d68834e0b5f03a4246d9",
      "target_identity": "sha256:04c970c2b0f7c128751ed2b0f7e672a2fe26dc267f018bf10e612096d19cfa04",
      "candidate_diff_sha256": "sha256:c18ffcaf6f41a8cd5f3399a10355eb8de3e5eb561cb65cb551ea93bdf4df921b",
      "changed_path_manifest_sha256": "sha256:dc754e73f2d661e2f914fdc5dd8d2a399be18567481137f43ae9d8d45aae3397",
      "lens": "review-risk",
      "selected_order": 0
    },
    {
      "schema": "gentle-ai.review-artifact-subject/v1",
      "subject_hash": "sha256:6374e313d6524b832afa399bdd205d4e852e1a19ea8d87000804789df6117e3b",
      "lineage_id": "review-start-fixture",
      "authority_revision": "sha256:e10bced7198e3c817c5ff6d1172d6aa8ce3321d45ec4d68834e0b5f03a4246d9",
      "target_identity": "sha256:04c970c2b0f7c128751ed2b0f7e672a2fe26dc267f018bf10e612096d19cfa04",
      "candidate_diff_sha256": "sha256:c18ffcaf6f41a8cd5f3399a10355eb8de3e5eb561cb65cb551ea93bdf4df921b",
      "changed_path_manifest_sha256": "sha256:dc754e73f2d661e2f914fdc5dd8d2a399be18567481137f43ae9d8d45aae3397",
      "lens": "review-resilience",
      "selected_order": 1
    },
    {
      "schema": "gentle-ai.review-artifact-subject/v1",
      "subject_hash": "sha256:56924c7ad539c596fd584905c9be7a82765e551154375a8022fb1e820bc2f61a",
      "lineage_id": "review-start-fixture",
      "authority_revision": "sha256:e10bced7198e3c817c5ff6d1172d6aa8ce3321d45ec4d68834e0b5f03a4246d9",
      "target_identity": "sha256:04c970c2b0f7c128751ed2b0f7e672a2fe26dc267f018bf10e612096d19cfa04",
      "candidate_diff_sha256": "sha256:c18ffcaf6f41a8cd5f3399a10355eb8de3e5eb561cb65cb551ea93bdf4df921b",
      "changed_path_manifest_sha256": "sha256:dc754e73f2d661e2f914fdc5dd8d2a399be18567481137f43ae9d8d45aae3397",
      "lens": "review-readability",
      "selected_order": 2
    },
    {
      "schema": "gentle-ai.review-artifact-subject/v1",
      "subject_hash": "sha256:0e15bc61702fd815c7140592e02d752143a0ac10a5fd59b4f8e8a8c0e8ea103b",
      "lineage_id": "review-start-fixture",
      "authority_revision": "sha256:e10bced7198e3c817c5ff6d1172d6aa8ce3321d45ec4d68834e0b5f03a4246d9",
      "target_identity": "sha256:04c970c2b0f7c128751ed2b0f7e672a2fe26dc267f018bf10e612096d19cfa04",
      "candidate_diff_sha256": "sha256:c18ffcaf6f41a8cd5f3399a10355eb8de3e5eb561cb65cb551ea93bdf4df921b",
      "changed_path_manifest_sha256": "sha256:dc754e73f2d661e2f914fdc5dd8d2a399be18567481137f43ae9d8d45aae3397",
      "lens": "review-reliability",
      "selected_order": 3
    }
  ],
  "candidate_diff": {
    "encoding": "base64",
    "data": "ZGlmZiAtLWdpdCBhL3NjcmlwdHMvZGVwbG95LnNoIGIvc2NyaXB0cy9kZXBsb3kuc2gKbmV3IGZpbGUgbW9kZSAxMDA2NDQKaW5kZXggMDAwMDAwMDAwMDAwMDAwMDAwMDAwMDAwMDAwMDAwMDAwMDAwMDAwMC4uMjhiM2FjMTI4ZmJiZWFmZmY0OWEzMjYxMDVmOGVhYzg1YzZjNzdhMQotLS0gL2Rldi9udWxsCisrKyBiL3NjcmlwdHMvZGVwbG95LnNoCkBAIC0wLDAgKzEgQEAKK2VjaG8gZGVwbG95Cg==",
    "sha256": "sha256:c18ffcaf6f41a8cd5f3399a10355eb8de3e5eb561cb65cb551ea93bdf4df921b",
    "byte_size": 226
  },
  "changed_path_manifest": [
    {"path":"scripts/deploy.sh","status":"A","old_mode":"000000","new_mode":"100644","deleted":false,"type_changed":false,"mode_only":false,"intended_untracked":false}
  ],
  "repository_context": {
    "capability": "review.opaque_repository_context",
    "handle": "rctx2_aaaaaaaaaaaaaaaaaaaaaaaaaaaaaaaaaaaaaaaaaaaaaaaaaaaaaaaaaaaaaaaa",
    "revision": "sha256:e10bced7198e3c817c5ff6d1172d6aa8ce3321d45ec4d68834e0b5f03a4246d9",
    "target_identity": "sha256:04c970c2b0f7c128751ed2b0f7e672a2fe26dc267f018bf10e612096d19cfa04"
  }
}
